{
  "$schema": "./course.schema.json",
  "courseId": 0,
  "courseName": "Village Green Golf Course",
  "tees": "White",
  "courseSide": "All",
  "location": "Moorhead, MN",
  "rating": 70.9,
  "slope": 128,
  "yardage": 6352,
  "par": 72,
  "holes": [
    {
      "holeNumber": 1,
      "yardage": 351,
      "par": 4,
      "handicap": 13
    },
    {
      "holeNumber": 2,
      "yardage": 390,
      "par": 4,
      "handicap": 1
    },
    {
      "holeNumber": 3,
      "yardage": 507,
      "par": 5,
      "handicap": 5
    },
    {
      "holeNumber": 4,
      "yardage": 141,
      "par": 3,
      "handicap": 15
    },
    {
      "holeNumber": 5,
      "yardage": 520,
      "par": 5,
      "handicap": 7
    },
    {
      "holeNumber": 6,
      "yardage": 117,
      "par": 3,
      "handicap": 17
    },
    {
      "holeNumber": 7,
      "yardage": 413,
      "par": 4,
      "handicap": 3
    },
    {
      "holeNumber": 8,
      "yardage": 335,
      "par": 4,
      "handicap": 11
    },
    {
      "holeNumber": 9,
      "yardage": 368,
      "par": 4,
      "handicap": 9
    },
    {
      "holeNumber": 10,
      "yardage": 499,
      "par": 5,
      "handicap": 12
    },
    {
      "holeNumber": 11,
      "yardage": 387,
      "par": 4,
      "handicap": 6
    },
    {
      "holeNumber": 12,
      "yardage": 298,
      "par": 4,
      "handicap": 14
    },
    {
      "holeNumber": 13,
      "yardage": 327,
      "par": 4,
      "handicap": 16
    },
    {
      "holeNumber": 14,
      "yardage": 168,
      "par": 3,
      "handicap": 18
    },
    {
      "holeNumber": 15,
      "yardage": 433,
      "par": 4,
      "handicap": 2
    },
    {
      "holeNumber": 16,
      "yardage": 505,
      "par": 5,
      "handicap": 8
    },
    {
      "holeNumber": 17,
      "yardage": 180,
      "par": 3,
      "handicap": 10
    },
    {
      "holeNumber": 18,
      "yardage": 413,
      "par": 4,
      "handicap": 4
    }
  ]
}