{
  "$schema": "./course.schema.json",
  "courseId": 0,
  "courseName": "Hawley Golf & Country Club",
  "tees": "White",
  "courseSide": "All",
  "location": "Hawley, MN",
  "rating": 67.5,
  "slope": 120,
  "yardage": 5773,
  "par": 71,
  "holes": [
    {
      "holeNumber": 1,
      "yardage": 303,
      "par": 4,
      "handicap": 17
    },
    {
      "holeNumber": 2,
      "yardage": 171,
      "par": 3,
      "handicap": 5
    },
    {
      "holeNumber": 3,
      "yardage": 388,
      "par": 4,
      "handicap": 3
    },
    {
      "holeNumber": 4,
      "yardage": 303,
      "par": 4,
      "handicap": 15
    },
    {
      "holeNumber": 5,
      "yardage": 493,
      "par": 5,
      "handicap": 1
    },
    {
      "holeNumber": 6,
      "yardage": 314,
      "par": 4,
      "handicap": 13
    },
    {
      "holeNumber": 7,
      "yardage": 355,
      "par": 4,
      "handicap": 11
    },
    {
      "holeNumber": 8,
      "yardage": 180,
      "par": 3,
      "handicap": 7
    },
    {
      "holeNumber": 9,
      "yardage": 503,
      "par": 5,
      "handicap": 9
    },
    {
      "holeNumber": 10,
      "yardage": 164,
      "par": 3,
      "handicap": 6
    },
    {
      "holeNumber": 11,
      "yardage": 277,
      "par": 4,
      "handicap": 18
    },
    {
      "holeNumber": 12,
      "yardage": 353,
      "par": 4,
      "handicap": 2
    },
    {
      "holeNumber": 13,
      "yardage": 134,
      "par": 3,
      "handicap": 16
    },
    {
      "holeNumber": 14,
      "yardage": 496,
      "par": 5,
      "handicap": 8
    },
    {
      "holeNumber": 15,
      "yardage": 362,
      "par": 4,
      "handicap": 4
    },
    {
      "holeNumber": 16,
      "yardage": 176,
      "par": 3,
      "handicap": 14
    },
    {
      "holeNumber": 17,
      "yardage": 471,
      "par": 5,
      "handicap": 10
    },
    {
      "holeNumber": 18,
      "yardage": 330,
      "par": 4,
      "handicap": 12
    }
  ]
}